{"kontra.escrow.status": "disputed", "kontra.escrow.quote": {"amount": "15.00", "currency": "USD"}, "kontra.escrow.holdId": "led_01HZX", "kontra.escrow.reviewEndsAt": "2026-11-02T10:00:00Z", "kontra.escrow.receipts": [{"event": "held", "rail": "ledger", "ref": "led_entry_7781", "at": "2026-11-01T09:00:00Z"}, {"event": "disputed", "rail": "ledger", "ref": "m-dispute-1", "at": "2026-11-01T12:30:00Z"}]}
